quote_id	doctrine_id	work_id	text	work_reference	year	stance	notes	citations
didache-baptism-water	baptismal-regeneration	didache	"Concerning baptism, baptize thus: having first said all these things, baptize into the name of the Father and of the Son and of the Holy Spirit in living water."	Didache 7	90	affirming		https://www.newadvent.org/fathers/0714.htm
ignatius-bishop-unity	monarchical-episcopacy	ignatius-smyrnaeans	"Wherever the bishop appears, there let the multitude be; even as wherever Jesus Christ is, there is the catholic Church."	Smyrnaeans 8	110	affirming		https://www.newadvent.org/fathers/0109.htm
irenaeus-succession	apostolic-succession	irenaeus-against-heresies	"It is within the power of all, therefore, in every Church, who may wish to see the truth, to contemplate clearly the tradition of the apostles manifested throughout the whole world."	Against Heresies 3.3	180	affirming		https://www.newadvent.org/fathers/0103.htm
1clement-apostles-appointed	apostolic-succession	1-clement	"The Apostles received the gospel for us from the Lord Jesus Christ; Jesus Christ was sent from God. Christ therefore is from God and the Apostles are from Christ. Both came in due order by the will of God… They appointed their first-fruits, having first proved them by the Spirit, to be bishops and deacons of those who should believe."	1 Clement 42.1–4	96	affirming		https://www.newadvent.org/fathers/1010.htm
1clement-episcopal-succession	apostolic-succession	1-clement	"Our apostles also knew, through our Lord Jesus Christ, that there would be strife on account of the office of the episcopate. For this reason, therefore, since they had obtained a perfect foreknowledge of this, they appointed those already mentioned, and afterwards gave instructions, that when these should fall asleep, other approved men should succeed them in their ministry."	1 Clement 44.1–2	96	affirming		https://www.newadvent.org/fathers/1010.htm
ignatius-romans-wheat	martyrdom-theology	ignatius-romans	"I am God's wheat, and I am ground by the teeth of wild beasts that I may be found pure bread of Christ."	Romans 4.1	107	affirming		https://www.newadvent.org/fathers/0107.htm
ignatius-ephesians-medicine	eucharistic-real-presence	ignatius-ephesians	"Breaking one bread, which is the medicine of immortality, and the antidote that we should not die, but live for ever in Jesus Christ."	Ephesians 20.2	107	affirming		https://www.newadvent.org/fathers/0104.htm
ignatius-smyrnaeans-flesh	eucharistic-real-presence	ignatius-smyrnaeans	"They abstain from the Eucharist and from prayer, because they confess not the Eucharist to be the flesh of our Saviour Jesus Christ, which suffered for our sins, and which the Father, of His goodness, raised up again."	Smyrnaeans 7.1	107	affirming		https://www.newadvent.org/fathers/0109.htm
ignatius-trallians-truly	docetism	ignatius-trallians	"Jesus Christ, who was of the race of David, who was the Son of Mary, who was truly born and ate and drank, was truly persecuted under Pontius Pilate, was truly crucified and died in the sight of those in heaven and on earth and under the earth; who was also truly raised from the dead, His Father having raised Him."	Trallians 9.1–2	107	condemning	Anti-docetist emphasis on the true bodily reality of Christ's life, death, and resurrection	https://www.newadvent.org/fathers/0106.htm
polycarp-phil-antichrist	docetism	polycarp-philippians	"For whosoever does not confess that Jesus Christ has come in the flesh, is antichrist; and whosoever does not confess the testimony of the Cross, is of the devil; and whosoever perverts the oracles of the Lord to his own lusts, and says that there is neither a resurrection nor a judgment, he is the firstborn of Satan."	Philippians 7.1	115	condemning		https://www.newadvent.org/fathers/0136.htm
justin-eucharist	eucharistic-real-presence	justin-first-apology	"For not as common bread and common drink do we receive these; but in like manner as Jesus Christ our Saviour, having been made flesh by the Word of God, had both flesh and blood for our salvation, so likewise have we been taught that the food which is blessed by the prayer of His word, and from which our blood and flesh by transmutation are nourished, is the flesh and blood of that Jesus who was made flesh."	1 Apology 66.2	155	affirming		https://www.newadvent.org/fathers/0126.htm
justin-baptism	baptismal-regeneration	justin-first-apology	"As many as are persuaded and believe that what we teach and say is true, and undertake to be able to live accordingly, are instructed to pray and to entreat God with fasting… Then they are brought by us where there is water, and are regenerated in the same manner in which we were ourselves regenerated. For, in the name of God, the Father and Lord of the universe, and of our Saviour Jesus Christ, and of the Holy Spirit, they then receive the washing with water."	1 Apology 61.2	155	affirming		https://www.newadvent.org/fathers/0126.htm
justin-sunday-eucharist	eucharistic-real-presence	justin-first-apology	"And on the day called Sunday, all who live in cities or in the country gather together to one place, and the memoirs of the apostles or the writings of the prophets are read… Then we all rise together and pray, and, as we before said, when our prayer is ended, bread and wine and water are brought, and the president in like manner offers prayers and thanksgivings, according to his ability, and the people assent, saying Amen; and there is a distribution to each, and a participation of that over which thanks have been given."	1 Apology 67	155	affirming	Earliest detailed description of Sunday Eucharistic liturgy	https://www.newadvent.org/fathers/0126.htm
irenaeus-rome-succession	apostolic-succession	irenaeus-against-heresies	"Since, however, it would be very tedious, in such a volume as this, to reckon up the successions of all the Churches, we do put to confusion all those who… assemble in unauthorized meetings; we do this by indicating that tradition derived from the apostles, of the very great, the very ancient, and universally known Church founded and organized at Rome by the two most glorious apostles, Peter and Paul."	Against Heresies 3.3.2	180	affirming		https://www.newadvent.org/fathers/0103.htm
irenaeus-glory-of-god	recapitulation	irenaeus-against-heresies	"The glory of God is a living man; and the life of man consists in beholding God."	Against Heresies 4.20.7	180	affirming	Often rendered 'Gloria Dei vivens homo'; key statement of Irenaeus's anthropology and soteriology	https://www.newadvent.org/fathers/0103.htm
irenaeus-recapitulation	recapitulation	irenaeus-against-heresies	"The Word of God, our Lord Jesus Christ, who did, through His transcendent love, become what we are, that He might bring us to be even what He Himself is."	Against Heresies 5, Preface	180	affirming		https://www.newadvent.org/fathers/0103.htm
irenaeus-millenarian	millenarianism-chiliasm	irenaeus-against-heresies	"In the times of the kingdom, the righteous man who is upon the earth shall then forget to die. For there shall be no more death, neither sorrow, neither shall there be any more pain… and it is just that in the very creation in which they toiled or were afflicted… in the very same, the just shall reign."	Against Heresies 5.32.1	180	affirming		https://www.newadvent.org/fathers/0103.htm
tertullian-trinity	nicene-trinitarian-theology	tertullian-adversus-praxeam	"All are of One, by unity of substance; while the mystery of the dispensation is still guarded, which distributes the Unity into a Trinity, placing in their order the three Persons — the Father, the Son, and the Holy Ghost: three, however, not in condition, but in degree; not in substance, but in form; not in power, but in aspect."	Against Praxeas 2	213	affirming	First use of Latin Trinitas (Trinity) in a fully theological sense; introduces tres personae, una substantia	https://www.newadvent.org/fathers/0317.htm
tertullian-rule-of-faith	rule-of-faith	tertullian-de-praescriptione	"The rule of faith, indeed, is altogether one, alone immoveable and irreformable; the rule, to wit, of believing in one only God omnipotent, the Creator of the universe, and His Son Jesus Christ, born of the Virgin Mary, crucified under Pontius Pilate, raised again the third day from the dead, received in the heavens, sitting now at the right of the Father, destined to come to judge the quick and the dead through the resurrection of the flesh as well as of the spirit."	Prescription Against Heretics 13	200	affirming		https://www.newadvent.org/fathers/0311.htm
tertullian-baptism-happy	baptismal-regeneration	tertullian-de-baptismo	"Happy is our sacrament of water, in that, by washing away the sins of our early blindness, we are set free and admitted into eternal life!"	On Baptism 1	198	affirming		https://www.newadvent.org/fathers/0307.htm
didache-eucharist	eucharistic-real-presence	didache	"Now about the Eucharist: This is how to give thanks: First in connection with the cup: 'We thank you, our Father, for the holy vine of David your servant, which you have revealed through Jesus your servant. To you be glory forever.' Then in connection with the piece broken off: 'We thank you, our Father, for the life and knowledge which you have revealed through Jesus your servant. To you be glory forever.'"	Didache 9.1–4	90	affirming		https://www.newadvent.org/fathers/0714.htm
cyprian-mother-church	monarchical-episcopacy	cyprian-de-unitate	"He can no longer have God for his Father, who has not the Church for his mother; if any one could escape who abandoned the ark of Noah, then he also may escape who shall be without the Church."	On the Unity of the Church 6	251	affirming		https://www.newadvent.org/fathers/050703.htm
papias-millenarian	millenarianism-chiliasm	shepherd-of-hermas	"The days will come in which vines shall grow, each having ten thousand branches, and in each branch ten thousand twigs, and in each true twig ten thousand shoots, and in each one of the shoots ten thousand clusters, and on every one of the clusters ten thousand grapes, and every grape when pressed will give five-and-twenty metretes of wine."	Fragment 1 (preserved in Irenaeus, Against Heresies 5.33.3–4)	120	affirming	Papias quotes this as a saying of the Lord preserved by elders who knew the apostles; represents chiliastic hope for the coming kingdom	https://www.newadvent.org/fathers/0125.htm
justin-millennium	millenarianism-chiliasm	justin-dialogue-trypho	"But I and others, who are right-minded Christians on all points, are assured that there will be a resurrection of the dead, and a thousand years in Jerusalem, which will then be built, adorned, and enlarged, as the prophets Ezekiel and Isaiah and others declare."	Dialogue with Trypho 80	155	affirming		https://www.newadvent.org/fathers/0128.htm
clement-alex-logos	logos-christology	clement-alexandria-protrepticus	"The Word of God became man, that you may learn from man how man may become God."	Protrepticus 1.8	195	affirming		https://www.newadvent.org/fathers/0208.htm
origen-logos-son	logos-christology	origen-de-principiis	"There is no time when [the Son] was not. For God the Father never existed when the Word was not… He is the eternal and everlasting Word."	On First Principles 1.2.2	225	affirming	Origen asserts co-eternity of the Son with the Father; though Origen's subordinationism is also present in De Principiis, this passage strongly affirms the eternal generation	https://www.newadvent.org/fathers/04120.htm
hippolytus-baptism-renunciation	baptismal-regeneration	hippolytus-apostolic-tradition	"When the person being baptized goes down into the water, he who baptizes him, putting his hand on him, shall say: 'Do you believe in God, the Father Almighty?' And he who is being baptized shall say: 'I believe.' Then holding his hand on his head, he shall baptize him once."	Apostolic Tradition 21	215	affirming	One of the oldest surviving accounts of the baptismal rite; triple interrogatory immersion form	https://www.newadvent.org/fathers/0732.htm
melito-true-king	martyrdom-theology	melito-on-pascha	"This is the one who made heaven and earth, and fashioned humankind in the beginning, who was proclaimed through the law and the prophets, who was enfleshed in a virgin, who was hanged on a tree, who was buried in earth, who was raised from the dead and went up to the heights of heaven… He is the Christ. He is the King forever and ever. Amen."	On Pascha 96	170	affirming	Melito's climactic confession of Christ as cosmic King and fulfillment of the Passover	https://www.newadvent.org/fathers/0181.htm
tertullian-blood-seed	martyrdom-theology	tertullian-apologeticus	"The oftener we are mown down by you, the more in number we grow; the blood of Christians is seed."	Apologeticus 50.13	197	affirming	The origin of the famous expression "the blood of martyrs is the seed of the Church"	https://www.newadvent.org/fathers/0301.htm
tertullian-regula-three-persons	nicene-trinitarian-theology	tertullian-adversus-praxeam	"We define that there are two, the Father and the Son, and with the Holy Spirit three, according to the principle of the divine economy which makes the number of the Trinity."	Adversus Praxeam 9	213	affirming	One of Tertullian's clearest statements of three-person Trinitarian theology	https://www.tertullian.org/anf/anf03/anf03-45.htm
tertullian-creatio-nihilo	creatio-ex-nihilo	tertullian-adversus-hermogenem	"God made all things from nothing. For this is the first point: that nothing was co-eternal with God, nothing co-unoriginate, nothing co-equal with God, lest, if something had been equally unborn and unmade and co-eternal with God, it should be pronounced God."	Adversus Hermogenem 14	205	affirming	Tertullian's clearest direct statement of creatio ex nihilo	https://www.newadvent.org/fathers/0311.htm
origen-apocatastasis	apocatastasis	origen-de-principiis	"We think that the goodness of God, through his Christ, will restore his entire creation to one end, even his enemies being conquered and subdued."	On First Principles 1.6.1	225	affirming	Origen's foundational statement of universal restoration (apocatastasis)	https://www.newadvent.org/fathers/04120.htm
origen-scripture-threefold	rule-of-faith	origen-de-principiis	"The Scriptures were composed through the Spirit of God, and they have not only that meaning which is obvious, but also another which is hidden from the majority of readers. For the contents of Scripture are the outward forms of certain mysteries and images of divine things."	On First Principles 4.1.6	225	affirming	Origen's foundational statement of allegorical/threefold biblical interpretation	https://www.newadvent.org/fathers/04120.htm
cyprian-unity-church	monarchical-episcopacy	cyprian-de-unitate	"You cannot have God for your Father if you have not the Church for your mother. If anyone could escape outside Noah's ark, then anyone outside the Church may also escape."	De Unitate Ecclesiae 6	251	affirming	One of the most influential ecclesiological statements in patristic literature	https://www.newadvent.org/fathers/050701.htm
cyprian-bishop-unity	monarchical-episcopacy	cyprian-de-unitate	"The episcopate is one, each part of which is held by each one for the whole. The Church also is one, which is spread abroad far and wide into a multitude by an increase of fruitfulness."	De Unitate Ecclesiae 5	251	affirming	Cyprian's foundational statement of episcopal collegiality and church unity	https://www.newadvent.org/fathers/050701.htm
cyprian-lapsed-penance	penitential-system	cyprian-de-lapsis	"Each one must do penance for his sin, and by the remedies of repentance make satisfaction to God: that the sinner must be humble in his grief, sad in his mourning, prostrate in his fasting… that he must implore God with tears, that he must implore his brethren with tears."	De Lapsis 29	251	affirming	Cyprian's articulation of the graduated penitential process for the lapsed	https://www.newadvent.org/fathers/050601.htm
polycarp-prayer-martyr	martyrdom-theology	martyrdom-polycarp	"Lord God Almighty, Father of thy well-beloved and blessed Son Jesus Christ, through whom we have received the knowledge of thee… I bless thee, because thou hast granted me this day and this hour, that I might take a portion amongst the number of the martyrs."	Martyrdom of Polycarp 14	155	affirming	Polycarp's prayer immediately before execution; one of the oldest verbatim martyr prayers preserved	https://www.newadvent.org/fathers/0102.htm
irenaeus-recapitulation-2	recapitulation	irenaeus-against-heresies	"The Lord, coming to the lost sheep and making so great a recapitulation of the economy of salvation, also recapitulated in himself the long line of human beings, and furnished us, in a brief and comprehensive manner, with salvation, so that what we had lost in Adam, namely, to be according to the image and likeness of God, that we might recover in Christ Jesus."	Against Heresies 3.18.1	185	affirming	Irenaeus's clearest statement of the recapitulation of Adam in Christ	https://www.newadvent.org/fathers/0103318.htm
irenaeus-creation-ex-nihilo	creatio-ex-nihilo	irenaeus-against-heresies	"He is himself uncreated, both without beginning and without end, and lacking nothing, and self-sufficient, and giving existence to all other things; but the things which have been made by him have received a beginning."	Against Heresies 4.38.3	185	affirming	Irenaeus's direct contrast of God's self-sufficiency with the creature's derived existence	https://www.newadvent.org/fathers/0103438.htm
hippolytus-against-noetus-two	patripassianism	hippolytus-against-noetus	"If I say that the Father suffered and died, I make him passible and mortal. But it was not the Father who became flesh and suffered, but the Son. The Father is he who commands, and the Son is he who obeys."	Against Noetus 7-8	205	opposing	Hippolytus's direct refutation of Noetus: the Father cannot suffer, only the Son	https://www.newadvent.org/fathers/0513.htm
theophilus-trias	nicene-trinitarian-theology	theophilus-to-autolycus-1	"In like manner also the three days which were before the luminaries are types of the Trinity: of God, and his Word, and his Wisdom."	Ad Autolycum 2.15	180	affirming	First known use of the Greek word Trias (Trinity) in Christian theology	https://www.newadvent.org/fathers/04062.htm
justin-eucharist-body	eucharistic-real-presence	justin-first-apology	"For not as common bread and common drink do we receive these; but in like manner as Jesus Christ our Savior, having been made flesh by the Word of God, had both flesh and blood for our salvation, so likewise have we been taught that the food which is blessed by the prayer of his word, and from which our blood and flesh by transmutation are nourished, is the flesh and blood of that Jesus who was made flesh."	1 Apology 66.2	150	affirming	One of the most explicit 2nd-century statements of eucharistic real presence	https://www.newadvent.org/fathers/0126.htm
lactantius-divine-wrath	martyrdom-theology	lactantius-divinae-institutiones	"God is not only the founder of this religion, but also its vindicator. For if anyone on earth has so great power as to be able to give laws to many nations, how much greater power has he who formed all nations, who reigns over all, who controls all things by his divine providence!"	Divine Institutes 5.19	310	affirming	Lactantius's apology for providential governance underpinning the persecution narratives	https://www.newadvent.org/fathers/0701.htm
dionysius-alex-sabellianism	modalism-sabellianism		"Neither, therefore, may we divide into three gods the wonderful and divine unity; nor may we depreciate the dignity and exceeding majesty of the Lord by the name of a mere creature; but we must believe in God the Father Almighty, and in Christ Jesus his Son, and in the Holy Spirit, and that the Word is united to the God of all."	Letter to Dionysius of Rome (in Athanasius, De Sent. Dionys. 13)	262	opposing	Dionysius of Alexandria correcting his earlier inadvertent tritheism; key pre-Nicene Trinitarian document	https://www.newadvent.org/fathers/2814.htm
papias-millennial-plenty	millenarianism-chiliasm	papias-fragments	"The days will come in which vines shall grow, each having ten thousand branches, and in each branch ten thousand twigs, and in each twig ten thousand shoots, and in every one of the shoots ten thousand clusters, and in every cluster ten thousand grapes, and every grape when pressed will give five-and-twenty metretes of wine."	Papias, Fragment 4 (in Irenaeus AH 5.33.3)	120	affirming	Papias's vivid millenarian prophecy, which he attributed to the Lord himself and which deeply influenced Irenaeus	https://www.newadvent.org/fathers/0125.htm
clement-rome-apostolic-chain	apostolic-succession	1-clement	"Our Apostles also knew, through our Lord Jesus Christ, that there would be strife over the name of the bishop's office. For this reason, having received perfect foreknowledge, they appointed those who have been mentioned, and afterwards added the further provision that, if they should fall asleep, other approved men should succeed to their ministry."	1 Clement 44.2	96	affirming	The locus classicus for apostolic succession theology in early Christianity	https://www.newadvent.org/fathers/1010.htm
ignatius-one-bishop	monarchical-episcopacy	ignatius-smyrnaeans	"Let no man do anything connected with the Church without the bishop. Let that be deemed a proper Eucharist, which is either under the bishop, or under one to whom he shall have entrusted it."	To the Smyrnaeans 8.1	107	affirming	Ignatius's clearest statement of the monarchical bishop as the centre of valid sacramental life	https://www.newadvent.org/fathers/0109.htm
victor-pascha-authority	monarchical-episcopacy	eusebius-ecclesiastical-history	"Victor, who presided over the church at Rome, immediately attempted to cut off from the common unity the parishes of all Asia, with the churches that agreed with them, as heterodox; and he wrote letters and declared all the brethren there wholly excommunicate."	Ecclesiastical History 5.24.9	190	affirming	Eusebius's account of Victor I's attempted excommunication of Asia — the first recorded Roman claim of universal disciplinary authority	https://www.newadvent.org/fathers/2501524.htm
methodius-resurrection-body	millenarianism-chiliasm	methodius-symposium	"It is impossible for man ever to arrive at the resurrection unless he has first passed through this earthly life; and for that reason the body rises in order that we may receive the recompense of our deeds done in the body."	Symposium 9.1	295	affirming	Methodius's insistence on bodily resurrection against Origen's spiritual resurrection doctrine	https://www.newadvent.org/fathers/0623.htm
eusebius-canon-list	canon-formation	eusebius-ecclesiastical-history	"Among the disputed books, which are nevertheless recognized by many, are extant the Epistle of James, as it is called, and that of Jude, and the second epistle of Peter, and those that are called the second and third of John."	Ecclesiastical History 3.25.3	315	affirming	Eusebius's four-category canon classification is the earliest systematic attempt at a NT canon list	https://www.newadvent.org/fathers/2501325.htm
papias-mark-peter	apostolic-succession	papias-fragments	"Mark, having become the interpreter of Peter, wrote down accurately whatsoever he remembered. It was not, however, in exact order that he related the sayings or deeds of Christ. For he neither heard the Lord nor accompanied him."	Fragment 3 (in Eusebius HE 3.39.15)	120	affirming	Oldest external testimony about the composition of the Gospel of Mark; links it to Peter's preaching	https://www.newadvent.org/fathers/0125.htm
athanasius-incarnation	logos-christology		"For he was made man that we might be made God; and he manifested himself by a body that we might receive the idea of the unseen Father; and he endured the insolence of men that we might inherit immortality."	On the Incarnation 54	318	affirming	Athanasius's classic statement of theosis through the Incarnation	https://www.newadvent.org/fathers/2800.htm
athanasius-word-became-flesh	logos-christology		"The Word of God, incorporeal and incorruptible and immaterial, came into our world. Not that he had been remote from it before; he was never without his Father's presence. But he put on a human body for the first time, that, so appearing, he might teach men to know him as God."	On the Incarnation 8	318	affirming	Athanasius's statement of the Logos assuming humanity without ceasing to be divine	https://www.newadvent.org/fathers/2800.htm
tertullian-flesh-hinge	docetism	tertullian-de-carne-christi	"The flesh is the hinge of salvation."	De Carne Christi 8	207	opposing	Tertullian's famous axiom caro salutis cardo: refutes Docetic denial of Christ's real flesh	https://www.newadvent.org/fathers/0315.htm
origen-scripture-spirit	rule-of-faith	origen-de-principiis	"Every one who is desirous of constructing out of the holy scriptures one connected body of doctrine must use points like these as his elementary and foundation principles."	On First Principles 4.1.1	225	affirming	Origen's programmatic statement on Scripture as the source of systematic Christian doctrine	https://www.newadvent.org/fathers/04120.htm
irenaeus-succession-rome	apostolic-succession	irenaeus-against-heresies	"To this Church, on account of its superior origin, all churches must agree — that is, all the faithful everywhere — in which church ever the tradition from the Apostles has been preserved by those who are everywhere."	Against Heresies 3.3.2	185	affirming	Irenaeus's foundational statement on Roman succession as the criterion of apostolic tradition	https://www.newadvent.org/fathers/0103303.htm
