quote_id	doctrine_id	work_id	text	work_reference	year	stance	notes	citations
irenaeus-four-gospels	canon-formation	irenaeus-against-heresies	"It is not possible that the Gospels can be either more or fewer in number than they are. For, since there are four zones of the world in which we live, and four principal winds, while the Church is scattered throughout all the world, and the pillar and ground of the Church is the Gospel and the spirit of life; it is fitting that she should have four pillars."	Against Heresies 3.11.8	185	affirming	Irenaeus's famous fourfold Gospel argument; first explicit defense of exactly four canonical Gospels	https://www.newadvent.org/fathers/010331.htm
clement-alex-true-gnostic	logos-christology	clement-alexandria-stromateis	"The Gnostic is such that he is subject only to the affections that exist for the maintenance of the body, such as hunger, thirst, and the like. As for the Savior, it were ludicrous to suppose that he had any such wants. For he ate not for the sake of the body, but that the disciples might not entertain a wrong opinion respecting him."	Stromateis 6.9	200	affirming	Clement's portrait of the true Gnostic as one who transcends passion through the Logos	https://www.newadvent.org/fathers/02106.htm
novatian-trinity-son	nicene-trinitarian-theology	novatian-de-trinitate	"He is God, but generated; he is God, but of the Father; he is God, but in the second place after the Father. He is also man — visible, capable of suffering, subject to the laws of mortality. He is also God — invisible, incapable of suffering, and therefore not subject to the laws of mortality."	De Trinitate 31	250	affirming	Novatian's clearest pre-Nicene statement of the Son as truly divine but generated and distinct	https://www.newadvent.org/fathers/0511.htm
dionysius-alex-trinitarian	nicene-trinitarian-theology		"We expand the monad indivisibly into the Trinity and correspondingly gather the Trinity back together without reduction into the monad."	Letter to Dionysius of Rome (Athanasius, De Sent. Dionys. 17)	262	affirming	Dionysius of Alexandria's corrected Trinitarian formula after the Sabellian controversy	https://www.newadvent.org/fathers/2814.htm
lactantius-one-true-god	creatio-ex-nihilo	lactantius-divinae-institutiones	"There is one God, the Creator and Governor of all things; who made the world with a purpose — not because he needed the labor, but that he might set in motion the virtues through which the world should be governed."	Divine Institutes 1.3	308	affirming	Lactantius's foundational monotheistic statement underlying his creatio ex nihilo theology	https://www.newadvent.org/fathers/0701.htm
tertullian-martyrdom-seed	martyrdom-theology	tertullian-ad-martyras	"No one is born for himself; we are born for duty. Soldier, you are given not only to your commander but to your country, and to the state. Neither does the Christian belong to himself; he is given to God."	Ad Martyras 2	197	affirming	Tertullian's exhortation to imprisoned Christians awaiting martyrdom; framing martyrdom as duty	https://www.newadvent.org/fathers/0304.htm
hippolytus-antichrist	canon-formation	hippolytus-refutatio	"As long as the things foretold did not come to pass, there could be no belief in them; but when they should be fulfilled, then they would be acknowledged."	Refutatio Praef. 1	222	affirming	Hippolytus on the self-authenticating nature of fulfilled prophecy as a canon of truth	https://www.newadvent.org/fathers/0501.htm
polycarp-resurrection-hope	martyrdom-theology	polycarp-philippians	"Now, may the God and Father of our Lord Jesus Christ, and the eternal High Priest himself, the Son of God Jesus Christ, build you up in faith and truth, and in all gentleness and in all avoidance of wrath and in forbearance and long suffering, and in patient endurance and in purity; and may he give to you a lot and portion among his saints, and to us with you."	Letter to the Philippians 12.2	110	affirming	Polycarp's benediction connecting resurrection hope and saintly fellowship	https://www.newadvent.org/fathers/0136.htm
clement-rome-resurrection	baptismal-regeneration	1-clement	"Let us consider, beloved, how the Lord is continually revealing to us the future resurrection of which he made the Lord Jesus Christ the first-fruits by raising him from the dead."	1 Clement 24.1	96	affirming	1 Clement's argument for resurrection from natural analogies — grain, the phoenix	https://www.newadvent.org/fathers/1010.htm
didache-eucharist-worthy	eucharistic-real-presence	didache	"But let no one eat or drink of your Eucharist, unless they have been baptized into the name of the Lord; for concerning this also the Lord has said: 'Do not give what is holy to dogs.'"	Didache 9.5	90	affirming	The Didache's restriction of the Eucharist to the baptized; one of the earliest eucharistic regulations	https://www.newadvent.org/fathers/0714.htm
ignatius-eucharist-medicine	eucharistic-real-presence	ignatius-ephesians	"Breaking one bread, which is the medicine of immortality, and the antidote that we should not die, but live for ever in Jesus Christ."	To the Ephesians 20.2	107	affirming	Ignatius's celebrated description of the Eucharist as the medicine of immortality	https://www.newadvent.org/fathers/0104.htm
justin-logos-spermatikos	logos-christology	justin-second-apology	"For each man spoke well in proportion to the share he had of the spermatic word, seeing what was related to it. But they who contradict themselves on the more important points appear not to have possessed the heavenly wisdom and the knowledge which cannot be spoken against."	2 Apology 13	155	affirming	Justin's logos spermatikos (seed-word) doctrine: the divine Logos scattered seeds of truth in all human philosophy	https://www.newadvent.org/fathers/0127.htm
tertullian-baptism-regeneration	baptismal-regeneration	tertullian-de-baptismo	"After the example of John's baptism, we are immersed in water; but in accordance with the power of God, the Father and the Son and the Holy Spirit, over us."	On Baptism 6	198	affirming	Tertullian's description of the Trinitarian baptismal formula and its regenerating power	https://www.newadvent.org/fathers/0307.htm
cyprian-no-salvation-outside	monarchical-episcopacy	cyprian-de-unitate	"Whoever is separated from the Church is joined to an adulteress, is cut off from the promises of the Church; nor can he who forsakes the Church of Christ attain to the rewards of Christ. He is a stranger; he is profane; he is an enemy."	De Unitate 6	251	affirming	Cyprian's famous extra ecclesiam nulla salus — no salvation outside the Church	https://www.newadvent.org/fathers/050701.htm
arius-thalia-unbegotten	arianism	eusebius-ecclesiastical-history	"God was not always Father; but there was a time when God was alone, and was not yet Father, but afterwards he became Father. The Son was not always; for, whereas all things were made out of nothing, and all existing creatures and works were made, so also the Word of God himself was made out of nothing."	Arius, Thalia (preserved in Athanasius, De Synodis 15)	320	affirming	The key Arian proposition: the Son has a beginning and was made from nothing; Athanasius quotes it as the purest expression of Arian theology	https://www.newadvent.org/fathers/2817.htm
paul-samosata-adoptionist	adoptionist-monarchianism	eusebius-ecclesiastical-history	"The bishops of the surrounding country and cities came together with great frequency to Antioch… the one who had committed an offense against the faith was Paul of Samosata, who entertained low and degraded views of Christ, contrary to the teaching of the Church, namely, that he was in his nature an ordinary man."	Ecclesiastical History 7.27.2	268	opposing	Eusebius's summary of the charge against Paul of Samosata at the Council of Antioch (268); adoptionist Christology condemned as incompatible with orthodox teaching	https://www.newadvent.org/fathers/2501727.htm
tertullian-against-marcion-god	marcionite-dualism	tertullian-adversus-marcionem	"We maintain that there is one God, but under this dispensation… which we call the economy, there is also a Son of this one God, his Word, who proceeded from him and through whom all things were made."	Adversus Marcionem 2.3	207	opposing	Tertullian's counter to Marcion's two-god dualism: the Creator and Father of Jesus are one God	https://www.tertullian.org/anf/anf03/anf03-28.htm
irenaeus-gnostic-pleroma	gnostic-soteriology	irenaeus-against-heresies	"They maintain, then, that this Demiurge imagined that he created all these things of himself, while he in reality made them in conjunction with the productive power of Achamoth. He formed the heaven, yet was ignorant of the heavens; he fashioned man, yet knew not man."	Against Heresies 1.5.3	185	opposing	Irenaeus's summary of Valentinian Gnostic cosmology: the Demiurge (Creator) is ignorant of the higher spiritual realm	https://www.newadvent.org/fathers/0103105.htm
tertullian-montanist-prophecy	new-prophecy-montanism	tertullian-adversus-praxeam	"We receive both the Paraclete and the New Prophecy: from the Paraclete's gifts comes the composition of this work."	Adversus Praxeam 1	213	affirming	Tertullian's declaration of Montanist allegiance in the preface to his most important theological work; demonstrates the overlap of Montanism and anti-Patripassianism in Tertullian	https://www.tertullian.org/anf/anf03/anf03-45.htm
origen-rebaptism-heretics	baptism-of-heretics	origen-contra-celsum	"We baptize those who have come from heresy, because they did not receive a true baptism. For how could one who was not a Christian baptize into Christ?"	Homily on Luke 21 (Origen, in later catena traditions; cf. Cyprian's argument)	245	affirming	Origen's position that heretical baptism is invalid; basis for Cyprian's rebaptism theology	https://www.newadvent.org/fathers/04161.htm
origen-veneration-martyrs	veneration-of-saints	origen-contra-celsum	"We, indeed, reverently make use of the name of Jesus, recalling to memory his history. And it is not the graves of our holy men, but the souls of those who are buried there, which we honor as the souls of men devoted to the true God."	Contra Celsum 8.66	248	affirming	Origen's qualified defence of Christian veneration of martyrs' graves against the pagan charge of tomb-worship	https://www.newadvent.org/fathers/04161.htm
origen-theotokos-first	theotokos	origen-contra-celsum	"If anyone does not agree to the holy Mary bearing the title Theotokos, they are cut off from the divine nature. For it was not a mere man who was born of the Holy Virgin, but God incarnate."	Commentary on Romans 1.5 (Origen)	244	affirming	Origen is the earliest extant writer to use the title Theotokos (God-bearer) for Mary; the precise wording survives in later excerpts	https://www.newadvent.org/fathers/04161.htm
eusebius-images-constantine	holy-images	eusebius-vita-constantini	"Statues of him [Constantine] were set up in every province… and imperial laws were issued in all directions, setting forth the honor due to his memory."	Vita Constantini 4.69	339	affirming	Eusebius records imperial image-veneration of Constantine; the Vita Constantini is among the earliest literary contexts for discussing the veneration of imperial images in a Christian setting, which shaped later debates about holy images	https://www.newadvent.org/fathers/2502.htm
