event_id	event_label	event_type	event_kind	notes
baptism-of-jesus	Baptism of Jesus	other	simple	Opening public-ministry event in the Gospel narratives.
calling-of-the-first-disciples	Calling of the First Disciples	mission	simple	Calling of Simon, Andrew, James, and John in Galilee.
council-of-jerusalem	Council of Jerusalem	council	simple	Jerusalem meeting concerning Gentile inclusion and circumcision.
pauls-conversion	Paul's Conversion	mission	simple	Encounter and reversal associated with the Damascus road and its aftermath.
sermon-on-the-mount	Sermon on the Mount	literary	simple	Representative teaching scene in Galilee.
stephens-martyrdom	Stephen's Martyrdom	martyrdom	simple	Early Jerusalem martyrdom narrated in Acts 7.
temple-cleansing	Temple Cleansing	political	simple	Jerusalem confrontation during the final phase of ministry.
