proposition_id	topic_id	dimension_id	proposition_label	polarity_family	description	notes
disciples-are-called-to-follow-jesus	discipleship	call-to-follow	Disciples are called to follow Jesus	call_to_follow	Jesus summons persons into direct discipleship.	
gentile-believers-need-not-be-circumcised	gentile-inclusion	gentile-circumcision	Gentile believers need not be circumcised	gentile_inclusion	Gentile inclusion in the people of God does not require circumcision.	
jesus-is-proclaimed-as-raised	resurrection-proclamation	jesus-resurrection	Jesus is proclaimed as raised	resurrection_proclamation	The apostolic proclamation announces that Jesus has been raised from the dead.	
jesus-teaches-with-unique-authority	jesus-authority	teaching-authority	Jesus teaches with unique authority	teaching_authority	Jesus is portrayed as speaking with authority that stands out from other teachers.	
kingdom-of-god-has-drawn-near	kingdom-proclamation	kingdom-proximity	The kingdom of God has drawn near	kingdom_proximity	Jesus proclamation presents God kingdom as imminently present or arriving.	
repentance-is-required	kingdom-proclamation	repentant-response	Repentance is required in response to the proclamation	repentance_response	The proclamation of the kingdom calls hearers to repentance.	
